2025-02-18 14:13:05,656 - 阻止來自未授權源 IP 172.16.38.93 的流量
2025-02-18 14:13:05,660 - 丟棄資料包: Ether / IP / TCP 172.16.38.93:50132 > 52.168.117.169:https PA / Raw
2025-02-18 14:13:05,665 - 阻止來自未授權源 IP 13.89.179.11 的流量
2025-02-18 14:13:05,665 - 丟棄資料包: Ether / IP / TCP 13.89.179.11:https > 172.16.38.93:50102 A
2025-02-18 14:13:05,670 - 阻止來自未授權源 IP 52.168.117.169 的流量
2025-02-18 14:13:05,670 - 丟棄資料包: Ether / IP / TCP 52.168.117.169:https > 172.16.38.93:50132 A / Raw
2025-02-18 14:13:05,678 - 阻止來自未授權源 IP 52.168.117.169 的流量
2025-02-18 14:13:05,678 - 丟棄資料包: Ether / IP / TCP 52.168.117.169:https > 172.16.38.93:50132 PA / Raw
2025-02-18 14:13:05,679 - 阻止來自未授權源 IP 172.16.38.93 的流量
2025-02-18 14:13:05,679 - 丟棄資料包: Ether / IP / TCP 172.16.38.93:50132 > 52.168.117.169:https A
2025-02-18 14:13:05,679 - 阻止來自未授權源 IP 172.16.38.93 的流量
2025-02-18 14:13:05,679 - 丟棄資料包: Ether / IP / TCP 172.16.38.93:50132 > 52.168.117.169:https PA / Raw
2025-02-18 14:13:05,983 - 丟棄資料包: Ether / ARP who has 172.16.37.244 says 172.16.32.1
2025-02-18 14:13:06,180 - 丟棄資料包: Ether / ARP who has 172.16.35.56 says 172.16.32.1
2025-02-18 14:13:06,539 - 阻止來自未授權源 IP 172.16.38.93 的流量
2025-02-18 14:13:06,539 - 丟棄資料包: Ether / IP / TCP 172.16.38.93:50132 > 52.168.117.169:https PA / Raw
2025-02-18 14:13:06,548 - 阻止來自未授權源 IP 52.168.117.169 的流量
2025-02-18 14:13:06,548 - 丟棄資料包: Ether / IP / TCP 52.168.117.169:https > 172.16.38.93:50132 PA / Raw
2025-02-18 14:13:06,548 - 阻止來自未授權源 IP 52.168.117.169 的流量
2025-02-18 14:13:06,548 - 丟棄資料包: Ether / IP / TCP 52.168.117.169:https > 172.16.38.93:50132 A
2025-02-18 14:13:06,548 - 阻止來自未授權源 IP 172.16.38.93 的流量
2025-02-18 14:13:06,548 - 丟棄資料包: Ether / IP / TCP 172.16.38.93:50132 > 52.168.117.169:https A
2025-02-18 14:13:06,548 - 阻止來自未授權源 IP 52.168.117.169 的流量
2025-02-18 14:13:06,548 - 丟棄資料包: Ether / IP / TCP 52.168.117.169:https > 172.16.38.93:50132 A
2025-02-18 14:13:06,548 - 阻止來自未授權源 IP 52.168.117.169 的流量
2025-02-18 14:13:06,548 - 丟棄資料包: Ether / IP / TCP 52.168.117.169:https > 172.16.38.93:50132 PA / Raw
2025-02-18 14:13:06,548 - 阻止來自未授權源 IP 52.168.117.169 的流量
2025-02-18 14:13:06,548 - 丟棄資料包: Ether / IP / TCP 52.168.117.169:https > 172.16.38.93:50132 A
2025-02-18 14:13:06,548 - 阻止來自未授權源 IP 52.168.117.169 的流量
2025-02-18 14:13:06,548 - 丟棄資料包: Ether / IP / TCP 52.168.117.169:https > 172.16.38.93:50132 FPA / Raw
2025-02-18 14:13:06,548 - 阻止來自未授權源 IP 172.16.38.93 的流量
2025-02-18 14:13:06,548 - 丟棄資料包: Ether / IP / TCP 172.16.38.93:50132 > 52.168.117.169:https A
2025-02-18 14:13:06,548 - 阻止來自未授權源 IP 172.16.38.93 的流量
2025-02-18 14:13:06,555 - 丟棄資料包: Ether / IP / TCP 172.16.38.93:50132 > 52.168.117.169:https PA / Raw
2025-02-18 14:13:06,555 - 阻止來自未授權源 IP 172.16.38.93 的流量
2025-02-18 14:13:06,555 - 丟棄資料包: Ether / IP / TCP 172.16.38.93:50132 > 52.168.117.169:https FA
2025-02-18 14:13:06,691 - 丟棄資料包: Ether / ARP who has 172.16.36.45 says 172.16.32.1
2025-02-18 14:13:07,198 - 丟棄資料包: Ether / ARP who has 172.16.35.56 says 172.16.32.1
2025-02-18 14:13:07,405 - 丟棄資料包: Ether / ARP who has 172.16.38.127 says 172.16.32.1
2025-02-18 14:13:07,474 - 阻止來自未授權源 IP 172.16.38.93 的流量
2025-02-18 14:13:07,474 - 丟棄資料包: Ether / IP / TCP 172.16.38.93:50132 > 52.168.117.169:https FPA / Raw
2025-02-18 14:13:07,476 - 阻止來自未授權源 IP 52.168.117.169 的流量
2025-02-18 14:13:07,476 - 丟棄資料包: Ether / IP / TCP 52.168.117.169:https > 172.16.38.93:50132 FPA / Raw
2025-02-18 14:13:07,476 - 阻止來自未授權源 IP 52.168.117.169 的流量
2025-02-18 14:13:07,476 - 丟棄資料包: Ether / IP / TCP 52.168.117.169:https > 172.16.38.93:50132 A
2025-02-18 14:13:07,476 - 阻止來自未授權源 IP 52.168.117.169 的流量
2025-02-18 14:13:07,481 - 丟棄資料包: Ether / IP / TCP 52.168.117.169:https > 172.16.38.93:50132 A
2025-02-18 14:13:07,481 - 阻止來自未授權源 IP 54.92.92.124 的流量
2025-02-18 14:13:07,481 - 丟棄資料包: Ether / IP / TCP 54.92.92.124:https > 172.16.38.93:56964 FPA / Raw
2025-02-18 14:13:07,481 - 阻止來自未授權源 IP 172.16.38.93 的流量
2025-02-18 14:13:07,481 - 丟棄資料包: Ether / IP / TCP 172.16.38.93:50132 > 52.168.117.169:https A
2025-02-18 14:13:08,428 - 丟棄資料包: Ether / ARP who has 172.16.38.127 says 172.16.32.1
2025-02-18 14:13:08,535 - 丟棄資料包: Ether / ARP who has 172.16.35.56 says 172.16.32.1
2025-02-18 14:13:08,631 - 丟棄資料包: Ether / ARP who has 172.16.37.208 says 172.16.32.1
2025-02-18 14:13:09,049 - 阻止來自未授權源 IP 172.16.38.93 的流量
2025-02-18 14:13:09,049 - 丟棄資料包: Ether / IP / TCP 172.16.38.93:50059 > 20.189.173.14:https RA
2025-02-18 14:13:09,050 - 阻止來自未授權源 IP 52.168.117.169 的流量
2025-02-18 14:13:09,050 - 丟棄資料包: Ether / IP / TCP 52.168.117.169:https > 172.16.38.93:50132 A
2025-02-18 14:13:09,153 - 丟棄資料包: Ether / ARP who has 172.16.39.26 says 172.16.32.1
2025-02-18 14:13:09,461 - 丟棄資料包: Ether / ARP who has 172.16.38.127 says 172.16.32.1
2025-02-18 14:13:09,562 - 丟棄資料包: Ether / ARP who has 172.16.35.56 says 172.16.32.1
2025-02-18 14:13:09,661 - 丟棄資料包: Ether / ARP who has 172.16.37.208 says 172.16.32.1
2025-02-18 14:13:10,170 - 丟棄資料包: Ether / ARP who has 172.16.39.26 says 172.16.32.1
2025-02-18 14:13:10,288 - 阻止來自未授權源 IP 172.16.38.93 的流量
2025-02-18 14:13:10,288 - 丟棄資料包: Ether / IP / UDP / DNS Qry b'main.vscode-cdn.net.'
2025-02-18 14:13:10,288 - 阻止來自未授權源 IP 172.16.38.93 的流量
2025-02-18 14:13:10,288 - 丟棄資料包: Ether / IP / UDP / DNS Qry b'main.vscode-cdn.net.'
2025-02-18 14:13:10,300 - 阻止來自未授權源 IP 168.95.1.1 的流量
2025-02-18 14:13:10,300 - 丟棄資料包: Ether / IP / UDP / DNS Ans b'vscode-cdn.z01.azurefd.net.'
2025-02-18 14:13:10,303 - 阻止來自未授權源 IP 168.95.1.1 的流量
2025-02-18 14:13:10,303 - 丟棄資料包: Ether / IP / UDP / DNS Ans b'vscode-cdn.z01.azurefd.net.'
2025-02-18 14:13:10,305 - 阻止來自未授權源 IP 172.16.38.93 的流量
2025-02-18 14:13:10,305 - 丟棄資料包: Ether / IP / TCP 172.16.38.93:50103 > 13.89.179.11:https FA
2025-02-18 14:13:10,305 - 阻止來自未授權源 IP 172.16.38.93 的流量
2025-02-18 14:13:10,305 - 丟棄資料包: Ether / IP / TCP 172.16.38.93:50133 > 13.107.246.73:https S
2025-02-18 14:13:10,309 - 阻止來自未授權源 IP 13.107.246.73 的流量
2025-02-18 14:13:10,311 - 丟棄資料包: Ether / IP / TCP 13.107.246.73:https > 172.16.38.93:50133 SA
2025-02-18 14:13:10,311 - 阻止來自未授權源 IP 172.16.38.93 的流量
2025-02-18 14:13:10,311 - 丟棄資料包: Ether / IP / TCP 172.16.38.93:50133 > 13.107.246.73:https A
2025-02-18 14:13:10,311 - 阻止來自未授權源 IP 172.16.38.93 的流量
2025-02-18 14:13:10,311 - 丟棄資料包: Ether / IP / TCP 172.16.38.93:50133 > 13.107.246.73:https PA / Raw
2025-02-18 14:13:10,331 - 阻止來自未授權源 IP 13.107.246.73 的流量
2025-02-18 14:13:10,331 - 丟棄資料包: Ether / IP / TCP 13.107.246.73:https > 172.16.38.93:50133 A
2025-02-18 14:13:10,333 - 阻止來自未授權源 IP 13.107.246.73 的流量
2025-02-18 14:13:10,333 - 丟棄資料包: Ether / IP / TCP 13.107.246.73:https > 172.16.38.93:50133 A
2025-02-18 14:13:10,334 - 阻止來自未授權源 IP 13.107.246.73 的流量
2025-02-18 14:13:10,334 - 丟棄資料包: Ether / IP / TCP 13.107.246.73:https > 172.16.38.93:50133 PA / Raw
2025-02-18 14:13:10,334 - 阻止來自未授權源 IP 172.16.38.93 的流量
2025-02-18 14:13:10,334 - 丟棄資料包: Ether / IP / TCP 172.16.38.93:50133 > 13.107.246.73:https PA / Raw
2025-02-18 14:13:10,340 - 阻止來自未授權源 IP 13.107.246.73 的流量
2025-02-18 14:13:10,340 - 丟棄資料包: Ether / IP / TCP 13.107.246.73:https > 172.16.38.93:50133 PA / Raw
2025-02-18 14:13:10,342 - 阻止來自未授權源 IP 172.16.38.93 的流量
2025-02-18 14:13:10,342 - 丟棄資料包: Ether / IP / TCP 172.16.38.93:50121 > 52.182.143.215:https A / Raw
2025-02-18 14:13:10,342 - 阻止來自未授權源 IP 172.16.38.93 的流量
2025-02-18 14:13:10,342 - 丟棄資料包: Ether / IP / TCP 172.16.38.93:50120 > 52.182.143.215:https A / Raw
2025-02-18 14:13:10,342 - 阻止來自未授權源 IP 172.16.38.93 的流量
2025-02-18 14:13:10,342 - 丟棄資料包: Ether / IP / TCP 172.16.38.93:50133 > 13.107.246.73:https PA / Raw
2025-02-18 14:13:10,342 - 阻止來自未授權源 IP 172.16.38.93 的流量
2025-02-18 14:13:10,342 - 丟棄資料包: Ether / IP / TCP 172.16.38.93:50133 > 13.107.246.73:https PA / Raw
2025-02-18 14:13:10,342 - 阻止來自未授權源 IP 172.16.38.93 的流量
2025-02-18 14:13:10,342 - 丟棄資料包: Ether / IP / TCP 172.16.38.93:50133 > 13.107.246.73:https PA / Raw
2025-02-18 14:13:10,342 - 阻止來自未授權源 IP 13.107.246.73 的流量
2025-02-18 14:13:10,342 - 丟棄資料包: Ether / IP / TCP 13.107.246.73:https > 172.16.38.93:50133 A
2025-02-18 14:13:10,350 - 阻止來自未授權源 IP 13.107.246.73 的流量
2025-02-18 14:13:10,350 - 丟棄資料包: Ether / IP / TCP 13.107.246.73:https > 172.16.38.93:50133 PA / Raw
2025-02-18 14:13:10,350 - 阻止來自未授權源 IP 13.107.246.73 的流量
2025-02-18 14:13:10,350 - 丟棄資料包: Ether / IP / TCP 13.107.246.73:https > 172.16.38.93:50133 PA / Raw
2025-02-18 14:13:10,350 - 阻止來自未授權源 IP 172.16.38.93 的流量
2025-02-18 14:13:10,350 - 丟棄資料包: Ether / IP / TCP 172.16.38.93:50133 > 13.107.246.73:https A
2025-02-18 14:13:10,352 - 阻止來自未授權源 IP 172.16.38.93 的流量
2025-02-18 14:13:10,352 - 丟棄資料包: Ether / IP / TCP 172.16.38.93:50133 > 13.107.246.73:https PA / Raw
2025-02-18 14:13:10,359 - 阻止來自未授權源 IP 13.107.246.73 的流量
2025-02-18 14:13:10,359 - 丟棄資料包: Ether / IP / TCP 13.107.246.73:https > 172.16.38.93:50133 PA / Raw
2025-02-18 14:13:10,359 - 阻止來自未授權源 IP 172.16.38.93 的流量
2025-02-18 14:13:10,359 - 丟棄資料包: Ether / IP / TCP 172.16.38.93:50133 > 13.107.246.73:https A
2025-02-18 14:13:10,366 - 阻止來自未授權源 IP 13.107.246.73 的流量
2025-02-18 14:13:10,366 - 丟棄資料包: Ether / IP / TCP 13.107.246.73:https > 172.16.38.93:50133 PA / Raw
2025-02-18 14:13:10,366 - 阻止來自未授權源 IP 172.16.38.93 的流量
2025-02-18 14:13:10,366 - 丟棄資料包: Ether / IP / TCP 172.16.38.93:50133 > 13.107.246.73:https A
2025-02-18 14:13:10,366 - 阻止來自未授權源 IP 13.107.246.73 的流量
2025-02-18 14:13:10,366 - 丟棄資料包: Ether / IP / TCP 13.107.246.73:https > 172.16.38.93:50133 A / Raw
2025-02-18 14:13:10,366 - 阻止來自未授權源 IP 172.16.38.93 的流量
2025-02-18 14:13:10,366 - 丟棄資料包: Ether / IP / TCP 172.16.38.93:50133 > 13.107.246.73:https A
2025-02-18 14:13:10,382 - 阻止來自未授權源 IP 13.107.246.73 的流量
2025-02-18 14:13:10,382 - 丟棄資料包: Ether / IP / TCP 13.107.246.73:https > 172.16.38.93:50133 PA / Raw
2025-02-18 14:13:10,390 - 阻止來自未授權源 IP 13.107.246.73 的流量
2025-02-18 14:13:10,390 - 丟棄資料包: Ether / IP / TCP 13.107.246.73:https > 172.16.38.93:50133 PA / Raw
2025-02-18 14:13:10,390 - 阻止來自未授權源 IP 172.16.38.93 的流量
2025-02-18 14:13:10,390 - 丟棄資料包: Ether / IP / TCP 172.16.38.93:50133 > 13.107.246.73:https A
2025-02-18 14:13:10,390 - 阻止來自未授權源 IP 13.107.246.73 的流量
2025-02-18 14:13:10,390 - 丟棄資料包: Ether / IP / TCP 13.107.246.73:https > 172.16.38.93:50133 PA / Raw
2025-02-18 14:13:10,390 - 阻止來自未授權源 IP 172.16.38.93 的流量
2025-02-18 14:13:10,392 - 丟棄資料包: Ether / IP / TCP 172.16.38.93:50133 > 13.107.246.73:https A
2025-02-18 14:13:10,406 - 阻止來自未授權源 IP 13.107.246.73 的流量
2025-02-18 14:13:10,407 - 丟棄資料包: Ether / IP / TCP 13.107.246.73:https > 172.16.38.93:50133 PA / Raw
2025-02-18 14:13:10,407 - 阻止來自未授權源 IP 172.16.38.93 的流量
2025-02-18 14:13:10,407 - 丟棄資料包: Ether / IP / TCP 172.16.38.93:50133 > 13.107.246.73:https A
2025-02-18 14:13:10,409 - 阻止來自未授權源 IP 13.107.246.73 的流量
2025-02-18 14:13:10,409 - 丟棄資料包: Ether / IP / TCP 13.107.246.73:https > 172.16.38.93:50133 PA / Raw
2025-02-18 14:13:10,409 - 阻止來自未授權源 IP 172.16.38.93 的流量
2025-02-18 14:13:10,414 - 丟棄資料包: Ether / IP / TCP 172.16.38.93:50133 > 13.107.246.73:https A
2025-02-18 14:13:10,420 - 阻止來自未授權源 IP 13.107.246.73 的流量
2025-02-18 14:13:10,420 - 丟棄資料包: Ether / IP / TCP 13.107.246.73:https > 172.16.38.93:50133 PA / Raw
2025-02-18 14:13:10,422 - 阻止來自未授權源 IP 172.16.38.93 的流量
2025-02-18 14:13:10,423 - 丟棄資料包: Ether / IP / TCP 172.16.38.93:50133 > 13.107.246.73:https A
2025-02-18 14:13:10,432 - 阻止來自未授權源 IP 13.107.246.73 的流量
2025-02-18 14:13:10,432 - 丟棄資料包: Ether / IP / TCP 13.107.246.73:https > 172.16.38.93:50133 PA / Raw
2025-02-18 14:13:10,432 - 阻止來自未授權源 IP 13.107.246.73 的流量
2025-02-18 14:13:10,432 - 丟棄資料包: Ether / IP / TCP 13.107.246.73:https > 172.16.38.93:50133 PA / Raw
2025-02-18 14:13:10,432 - 阻止來自未授權源 IP 172.16.38.93 的流量
2025-02-18 14:13:10,432 - 丟棄資料包: Ether / IP / TCP 172.16.38.93:50133 > 13.107.246.73:https A
2025-02-18 14:13:10,438 - 阻止來自未授權源 IP 13.107.246.73 的流量
2025-02-18 14:13:10,438 - 丟棄資料包: Ether / IP / TCP 13.107.246.73:https > 172.16.38.93:50133 PA / Raw
2025-02-18 14:13:10,440 - 阻止來自未授權源 IP 13.107.246.73 的流量
2025-02-18 14:13:10,440 - 丟棄資料包: Ether / IP / TCP 13.107.246.73:https > 172.16.38.93:50133 PA / Raw
2025-02-18 14:13:10,440 - 阻止來自未授權源 IP 172.16.38.93 的流量
2025-02-18 14:13:10,440 - 丟棄資料包: Ether / IP / TCP 172.16.38.93:50133 > 13.107.246.73:https A
2025-02-18 14:13:10,440 - 阻止來自未授權源 IP 172.16.38.93 的流量
2025-02-18 14:13:10,440 - 丟棄資料包: Ether / IP / TCP 172.16.38.93:50133 > 13.107.246.73:https A
2025-02-18 14:13:10,442 - 阻止來自未授權源 IP 13.107.246.73 的流量
2025-02-18 14:13:10,442 - 丟棄資料包: Ether / IP / TCP 13.107.246.73:https > 172.16.38.93:50133 PA / Raw
2025-02-18 14:13:10,442 - 阻止來自未授權源 IP 172.16.38.93 的流量
2025-02-18 14:13:10,446 - 丟棄資料包: Ether / IP / TCP 172.16.38.93:50133 > 13.107.246.73:https A
2025-02-18 14:13:10,452 - 阻止來自未授權源 IP 13.107.246.73 的流量
2025-02-18 14:13:10,452 - 丟棄資料包: Ether / IP / TCP 13.107.246.73:https > 172.16.38.93:50133 PA / Raw
2025-02-18 14:13:10,453 - 阻止來自未授權源 IP 172.16.38.93 的流量
2025-02-18 14:13:10,453 - 丟棄資料包: Ether / IP / TCP 172.16.38.93:50133 > 13.107.246.73:https A
2025-02-18 14:13:10,457 - 阻止來自未授權源 IP 13.107.246.73 的流量
2025-02-18 14:13:10,457 - 丟棄資料包: Ether / IP / TCP 13.107.246.73:https > 172.16.38.93:50133 PA / Raw
2025-02-18 14:13:10,457 - 阻止來自未授權源 IP 172.16.38.93 的流量
2025-02-18 14:13:10,457 - 丟棄資料包: Ether / IP / TCP 172.16.38.93:50133 > 13.107.246.73:https A
2025-02-18 14:13:10,457 - 阻止來自未授權源 IP 13.107.246.73 的流量
2025-02-18 14:13:10,457 - 丟棄資料包: Ether / IP / TCP 13.107.246.73:https > 172.16.38.93:50133 PA / Raw
2025-02-18 14:13:10,457 - 阻止來自未授權源 IP 172.16.38.93 的流量
2025-02-18 14:13:10,457 - 丟棄資料包: Ether / IP / TCP 172.16.38.93:50133 > 13.107.246.73:https A
2025-02-18 14:13:10,499 - 阻止來自未授權源 IP 13.89.179.11 的流量
2025-02-18 14:13:10,499 - 丟棄資料包: Ether / IP / TCP 13.89.179.11:https > 172.16.38.93:50103 RA
2025-02-18 14:13:10,523 - 阻止來自未授權源 IP 52.182.143.215 的流量
2025-02-18 14:13:10,523 - 丟棄資料包: Ether / IP / TCP 52.182.143.215:https > 172.16.38.93:50121 A
2025-02-18 14:13:10,525 - 阻止來自未授權源 IP 52.182.143.215 的流量
2025-02-18 14:13:10,525 - 丟棄資料包: Ether / IP / TCP 52.182.143.215:https > 172.16.38.93:50120 A
2025-02-18 14:13:10,593 - 丟棄資料包: Ether / ARP who has 172.16.35.56 says 172.16.32.1
2025-02-18 14:13:10,593 - 丟棄資料包: Ether / ARP who has 172.16.38.6 says 172.16.32.1
2025-02-18 14:13:10,593 - 丟棄資料包: Ether / ARP who has 172.16.37.208 says 172.16.32.1
2025-02-18 14:13:11,609 - 丟棄資料包: Ether / ARP who has 172.16.38.6 says 172.16.32.1
2025-02-18 14:13:11,960 - 阻止來自未授權源 IP 172.16.38.93 的流量
2025-02-18 14:13:11,960 - 丟棄資料包: Ether / IP / TCP 172.16.38.93:50074 > 142.250.66.67:https A / Raw
2025-02-18 14:13:11,965 - 阻止來自未授權源 IP 142.250.66.67 的流量
2025-02-18 14:13:11,966 - 丟棄資料包: Ether / IP / TCP 142.250.66.67:https > 172.16.38.93:50074 A
2025-02-18 14:13:12,110 - 丟棄資料包: Ether / ARP who has 172.16.38.127 says 172.16.32.1
2025-02-18 14:13:12,529 - 丟棄資料包: Ether / ARP who has 172.16.38.6 says 172.16.32.1
2025-02-18 14:13:13,349 - 丟棄資料包: Ether / ARP who has 172.16.37.208 says 172.16.32.1
2025-02-18 14:13:13,650 - 阻止來自未授權源 IP 172.16.38.93 的流量
2025-02-18 14:13:13,650 - 丟棄資料包: Ether / IP / TCP 172.16.38.93:49906 > 162.159.136.234:https PA / Raw
2025-02-18 14:13:13,965 - 阻止來自未授權源 IP 172.16.38.93 的流量
2025-02-18 14:13:13,965 - 丟棄資料包: Ether / IP / TCP 172.16.38.93:49906 > 162.159.136.234:https PA / Raw
2025-02-18 14:13:13,970 - 阻止來自未授權源 IP 162.159.136.234 的流量
2025-02-18 14:13:13,970 - 丟棄資料包: Ether / IP / TCP 162.159.136.234:https > 172.16.38.93:49906 A
2025-02-18 14:13:13,972 - 阻止來自未授權源 IP 162.159.136.234 的流量
2025-02-18 14:13:13,972 - 丟棄資料包: Ether / IP / TCP 162.159.136.234:https > 172.16.38.93:49906 PA / Raw
2025-02-18 14:13:14,000 - 阻止來自未授權源 IP 162.159.136.234 的流量
2025-02-18 14:13:14,000 - 丟棄資料包: Ether / IP / TCP 162.159.136.234:https > 172.16.38.93:49906 A
2025-02-18 14:13:14,017 - 阻止來自未授權源 IP 172.16.38.93 的流量
2025-02-18 14:13:14,017 - 丟棄資料包: Ether / IP / TCP 172.16.38.93:49906 > 162.159.136.234:https A
2025-02-18 14:13:14,071 - 丟棄資料包: Ether / ARP who has 172.16.33.224 says 172.16.32.1
2025-02-18 14:13:14,071 - 丟棄資料包: Ether / ARP who has 172.16.38.127 says 172.16.32.1
2025-02-18 14:13:14,577 - 丟棄資料包: Ether / ARP who has 172.16.35.196 says 172.16.32.1
2025-02-18 14:13:15,191 - 丟棄資料包: Ether / ARP who has 172.16.33.80 says 172.16.32.1
2025-02-18 14:13:15,291 - 丟棄資料包: Ether / ARP who has 172.16.37.208 says 172.16.32.1
2025-02-18 14:13:15,491 - 阻止來自未授權源 IP 172.16.38.93 的流量
2025-02-18 14:13:15,491 - 丟棄資料包: Ether / IP / TCP 172.16.38.93:49957 > 103.28.54.101:27021 PA / Raw
2025-02-18 14:13:15,520 - 阻止來自未授權源 IP 103.28.54.101 的流量
2025-02-18 14:13:15,520 - 丟棄資料包: Ether / IP / TCP 103.28.54.101:27021 > 172.16.38.93:49957 A
2025-02-18 14:13:15,703 - 丟棄資料包: Ether / ARP who has 172.16.36.120 says 172.16.32.1
2025-02-18 14:13:16,012 - 丟棄資料包: Ether / ARP who has 172.16.38.6 says 172.16.32.1
2025-02-18 14:13:16,012 - 丟棄資料包: Ether / ARP who has 172.16.33.224 says 172.16.32.1
2025-02-18 14:13:16,108 - 丟棄資料包: Ether / ARP who has 172.16.39.13 says 172.16.32.1
2025-02-18 14:13:16,108 - 丟棄資料包: Ether / ARP who has 172.16.33.80 says 172.16.32.1
2025-02-18 14:13:16,524 - 丟棄資料包: Ether / ARP who has 172.16.35.196 says 172.16.32.1
2025-02-18 14:13:16,726 - 丟棄資料包: Ether / ARP who has 172.16.36.120 says 172.16.32.1
2025-02-18 14:13:16,726 - 丟棄資料包: Ether / ARP who has 172.16.38.127 says 172.16.32.1
2025-02-18 14:13:16,956 - 阻止來自未授權源 IP 172.16.38.93 的流量
2025-02-18 14:13:16,956 - 丟棄資料包: Ether / IP / UDP / DNS Qry b'ctldl.windowsupdate.com.'
2025-02-18 14:13:16,978 - 阻止來自未授權源 IP 168.95.1.1 的流量
2025-02-18 14:13:16,978 - 丟棄資料包: Ether / IP / UDP / DNS Ans b'ctldl.windowsupdate.com.delivery.microsoft.com.'
2025-02-18 14:13:16,978 - 阻止來自未授權源 IP 172.16.38.93 的流量
2025-02-18 14:13:16,978 - 丟棄資料包: Ether / IP / TCP 172.16.38.93:50134 > 43.159.70.162:http S
2025-02-18 14:13:17,028 - 丟棄資料包: Ether / ARP who has 172.16.38.6 says 172.16.32.1
2025-02-18 14:13:17,028 - 阻止來自未授權源 IP 43.159.70.162 的流量
2025-02-18 14:13:17,028 - 丟棄資料包: Ether / IP / TCP 43.159.70.162:http > 172.16.38.93:50134 SA
2025-02-18 14:13:17,028 - 阻止來自未授權源 IP 172.16.38.93 的流量
2025-02-18 14:13:17,028 - 丟棄資料包: Ether / IP / TCP 172.16.38.93:50134 > 43.159.70.162:http A
2025-02-18 14:13:17,028 - 阻止來自未授權源 IP 172.16.38.93 的流量
2025-02-18 14:13:17,028 - 丟棄資料包: Ether / IP / TCP 172.16.38.93:50134 > 43.159.70.162:http PA / Raw
2025-02-18 14:13:17,072 - 阻止來自未授權源 IP 43.159.70.162 的流量
2025-02-18 14:13:17,077 - 丟棄資料包: Ether / IP / TCP 43.159.70.162:http > 172.16.38.93:50134 A
2025-02-18 14:13:17,077 - 阻止來自未授權源 IP 43.159.70.162 的流量
2025-02-18 14:13:17,077 - 丟棄資料包: Ether / IP / TCP 43.159.70.162:http > 172.16.38.93:50134 PA / Raw
2025-02-18 14:13:17,079 - 阻止來自未授權源 IP 43.159.70.162 的流量
2025-02-18 14:13:17,079 - 丟棄資料包: Ether / IP / TCP 43.159.70.162:http > 172.16.38.93:50134 FA
2025-02-18 14:13:17,079 - 阻止來自未授權源 IP 172.16.38.93 的流量
2025-02-18 14:13:17,079 - 丟棄資料包: Ether / IP / TCP 172.16.38.93:50134 > 43.159.70.162:http A
2025-02-18 14:13:17,079 - 阻止來自未授權源 IP 172.16.38.93 的流量
2025-02-18 14:13:17,081 - 丟棄資料包: Ether / IP / TCP 172.16.38.93:50134 > 43.159.70.162:http FA
2025-02-18 14:13:17,103 - 阻止來自未授權源 IP 43.159.70.162 的流量
2025-02-18 14:13:17,103 - 丟棄資料包: Ether / IP / TCP 43.159.70.162:http > 172.16.38.93:50134 PA / Raw
2025-02-18 14:13:17,103 - 阻止來自未授權源 IP 172.16.38.93 的流量
2025-02-18 14:13:17,103 - 丟棄資料包: Ether / IP / TCP 172.16.38.93:50134 > 43.159.70.162:http A
2025-02-18 14:13:17,130 - 丟棄資料包: Ether / ARP who has 172.16.39.13 says 172.16.32.1
2025-02-18 14:13:17,130 - 丟棄資料包: Ether / ARP who has 172.16.33.80 says 172.16.32.1
2025-02-18 14:13:17,132 - 阻止來自未授權源 IP 43.159.70.162 的流量
2025-02-18 14:13:17,132 - 丟棄資料包: Ether / IP / TCP 43.159.70.162:http > 172.16.38.93:50134 A
2025-02-18 14:13:17,413 - 阻止來自未授權源 IP 172.16.38.93 的流量
2025-02-18 14:13:17,413 - 丟棄資料包: Ether / IP / TCP 172.16.38.93:50123 > 3.233.158.24:https A / Raw
2025-02-18 14:13:17,413 - 阻止來自未授權源 IP 172.16.38.93 的流量
2025-02-18 14:13:17,415 - 丟棄資料包: Ether / IP / TCP 172.16.38.93:50124 > 3.233.158.24:https A / Raw
2025-02-18 14:13:17,542 - 丟棄資料包: Ether / ARP who has 172.16.38.157 says 172.16.32.1
2025-02-18 14:13:17,748 - 丟棄資料包: Ether / ARP who has 172.16.38.127 says 172.16.32.1
2025-02-18 14:13:18,568 - 丟棄資料包: Ether / ARP who has 172.16.38.157 says 172.16.32.1
2025-02-18 14:13:18,776 - 丟棄資料包: Ether / ARP who has 172.16.38.127 says 172.16.32.1
2025-02-18 14:13:18,981 - 丟棄資料包: Ether / ARP who has 172.16.37.208 says 172.16.32.1
2025-02-18 14:13:19,184 - 丟棄資料包: Ether / ARP who has 172.16.39.91 says 172.16.32.1
2025-02-18 14:13:20,111 - 丟棄資料包: Ether / ARP who has 172.16.38.6 says 172.16.32.1
2025-02-18 14:13:20,209 - 丟棄資料包: Ether / ARP who has 172.16.39.91 says 172.16.32.1
2025-02-18 14:13:20,513 - 丟棄資料包: Ether / ARP who has 172.16.39.13 says 172.16.32.1
2025-02-18 14:13:20,821 - 丟棄資料包: Ether / ARP who has 172.16.33.80 says 172.16.32.1
2025-02-18 14:13:20,821 - 丟棄資料包: Ether / ARP who has 172.16.37.244 says 172.16.32.1
2025-02-18 14:13:21,130 - 丟棄資料包: Ether / ARP who has 172.16.38.127 says 172.16.32.1
2025-02-18 14:13:21,230 - 丟棄資料包: Ether / ARP who has 172.16.39.91 says 172.16.32.1
2025-02-18 14:13:21,230 - 丟棄資料包: Ether / ARP who has 172.16.38.6 says 172.16.32.1
2025-02-18 14:13:21,539 - 丟棄資料包: Ether / ARP who has 172.16.39.13 says 172.16.32.1
2025-02-18 14:13:21,740 - 丟棄資料包: Ether / ARP who has 172.16.33.80 says 172.16.32.1
2025-02-18 14:13:21,841 - 丟棄資料包: Ether / ARP who has 172.16.37.244 says 172.16.32.1
2025-02-18 14:13:22,564 - 丟棄資料包: Ether / ARP who has 172.16.39.13 says 172.16.32.1
2025-02-18 14:13:22,874 - 丟棄資料包: Ether / ARP who has 172.16.37.244 says 172.16.32.1
2025-02-18 14:13:22,938 - 阻止來自未授權源 IP 172.16.38.93 的流量
2025-02-18 14:13:22,938 - 丟棄資料包: Ether / IP / TCP 172.16.38.93:50022 > 142.251.170.188:5228 A / Raw
2025-02-18 14:13:22,939 - 阻止來自未授權源 IP 52.123.129.14 的流量
2025-02-18 14:13:22,939 - 丟棄資料包: Ether / IP / TCP 52.123.129.14:https > 172.16.38.93:50116 RA
2025-02-18 14:13:22,939 - 阻止來自未授權源 IP 3.233.158.24 的流量
2025-02-18 14:13:22,939 - 丟棄資料包: Ether / IP / TCP 3.233.158.24:https > 172.16.38.93:50123 A
2025-02-18 14:13:22,939 - 阻止來自未授權源 IP 3.233.158.24 的流量
2025-02-18 14:13:22,939 - 丟棄資料包: Ether / IP / TCP 3.233.158.24:https > 172.16.38.93:50124 A
2025-02-18 14:13:22,946 - 阻止來自未授權源 IP 142.251.170.188 的流量
2025-02-18 14:13:22,946 - 丟棄資料包: Ether / IP / TCP 142.251.170.188:5228 > 172.16.38.93:50022 A
2025-02-18 14:13:23,071 - 丟棄資料包: Ether / ARP who has 172.16.33.80 says 172.16.32.1
2025-02-18 14:13:23,091 - 阻止來自未授權源 IP 172.16.38.93 的流量
2025-02-18 14:13:23,091 - 丟棄資料包: Ether / IP / UDP / DNS Qry b'teams.events.data.microsoft.com.'
2025-02-18 14:13:23,093 - 阻止來自未授權源 IP 172.16.38.93 的流量
2025-02-18 14:13:23,093 - 丟棄資料包: Ether / IP / UDP / DNS Qry b'teams.events.data.microsoft.com.'
2025-02-18 14:13:23,093 - 阻止來自未授權源 IP 172.16.38.93 的流量
2025-02-18 14:13:23,093 - 丟棄資料包: Ether / IP / TCP 172.16.38.93:50120 > 52.182.143.215:https PA / Raw
2025-02-18 14:13:23,095 - 阻止來自未授權源 IP 172.16.38.93 的流量
2025-02-18 14:13:23,095 - 丟棄資料包: Ether / IP / TCP 172.16.38.93:50120 > 52.182.143.215:https PA / Raw
2025-02-18 14:13:23,095 - 阻止來自未授權源 IP 172.16.38.93 的流量
2025-02-18 14:13:23,095 - 丟棄資料包: Ether / IP / TCP 172.16.38.93:50120 > 52.182.143.215:https PA / Raw
2025-02-18 14:13:23,106 - 阻止來自未授權源 IP 168.95.1.1 的流量
2025-02-18 14:13:23,106 - 丟棄資料包: Ether / IP / UDP / DNS Ans b'teams-events-data.trafficmanager.net.'
2025-02-18 14:13:23,106 - 阻止來自未授權源 IP 168.95.1.1 的流量
2025-02-18 14:13:23,106 - 丟棄資料包: Ether / IP / UDP / DNS Ans b'teams-events-data.trafficmanager.net.'
2025-02-18 14:13:23,184 - 丟棄資料包: Ether / ARP who has 172.16.38.127 says 172.16.32.1
2025-02-18 14:13:23,775 - 阻止來自未授權源 IP 172.16.38.93 的流量
2025-02-18 14:13:23,775 - 丟棄資料包: Ether / IP / TCP 172.16.38.93:50120 > 52.182.143.215:https PA / Raw
2025-02-18 14:13:23,777 - 丟棄資料包: Ether / ARP who has 172.16.38.93 says 172.16.32.1
2025-02-18 14:13:23,777 - 丟棄資料包: Ether / ARP is at e8:b0:c5:26:5e:99 says 172.16.38.93
2025-02-18 14:13:23,777 - 阻止來自未授權源 IP 52.182.143.215 的流量
2025-02-18 14:13:23,777 - 丟棄資料包: Ether / IP / TCP 52.182.143.215:https > 172.16.38.93:50120 A
2025-02-18 14:13:23,777 - 阻止來自未授權源 IP 52.182.143.215 的流量
2025-02-18 14:13:23,777 - 丟棄資料包: Ether / IP / TCP 52.182.143.215:https > 172.16.38.93:50120 A
2025-02-18 14:13:23,782 - 阻止來自未授權源 IP 52.182.143.215 的流量
2025-02-18 14:13:23,782 - 丟棄資料包: Ether / IP / TCP 52.182.143.215:https > 172.16.38.93:50120 PA / Raw
2025-02-18 14:13:23,829 - 阻止來自未授權源 IP 172.16.38.93 的流量
2025-02-18 14:13:23,829 - 丟棄資料包: Ether / IP / TCP 172.16.38.93:50120 > 52.182.143.215:https A
2025-02-18 14:13:23,998 - 丟棄資料包: Ether / ARP who has 172.16.33.80 says 172.16.32.1
2025-02-18 14:13:25,021 - 丟棄資料包: Ether / ARP who has 172.16.33.80 says 172.16.32.1
2025-02-18 14:13:25,426 - 阻止來自未授權源 IP 172.16.38.93 的流量
2025-02-18 14:13:25,426 - 丟棄資料包: Ether / IP / TCP 172.16.38.93:49892 > 104.16.55.40:https A / Raw
2025-02-18 14:13:25,431 - 阻止來自未授權源 IP 52.182.143.215 的流量
2025-02-18 14:13:25,431 - 丟棄資料包: Ether / IP / TCP 52.182.143.215:https > 172.16.38.93:50120 A
2025-02-18 14:13:25,433 - 阻止來自未授權源 IP 52.182.143.215 的流量
2025-02-18 14:13:25,433 - 丟棄資料包: Ether / IP / TCP 52.182.143.215:https > 172.16.38.93:50120 PA / Raw
2025-02-18 14:13:25,433 - 阻止來自未授權源 IP 52.182.143.215 的流量
2025-02-18 14:13:25,435 - 丟棄資料包: Ether / IP / TCP 52.182.143.215:https > 172.16.38.93:50120 PA / Raw
2025-02-18 14:13:25,436 - 阻止來自未授權源 IP 172.16.38.93 的流量
2025-02-18 14:13:25,436 - 丟棄資料包: Ether / IP / TCP 172.16.38.93:50120 > 52.182.143.215:https A
2025-02-18 14:13:25,437 - 阻止來自未授權源 IP 172.16.38.93 的流量
2025-02-18 14:13:25,437 - 丟棄資料包: Ether / IP / TCP 172.16.38.93:50120 > 52.182.143.215:https PA / Raw
2025-02-18 14:13:25,437 - 阻止來自未授權源 IP 104.16.55.40 的流量
2025-02-18 14:13:25,437 - 丟棄資料包: Ether / IP / TCP 104.16.55.40:https > 172.16.38.93:49892 A
2025-02-18 14:13:26,220 - 阻止來自未授權源 IP 172.16.38.93 的流量
2025-02-18 14:13:26,220 - 丟棄資料包: Ether / IP / TCP 172.16.38.93:50120 > 52.182.143.215:https PA / Raw
2025-02-18 14:13:26,220 - 阻止來自未授權源 IP 52.182.143.215 的流量
2025-02-18 14:13:26,220 - 丟棄資料包: Ether / IP / TCP 52.182.143.215:https > 172.16.38.93:50120 A
2025-02-18 14:13:26,559 - 丟棄資料包: Ether / ARP who has 172.16.33.80 says 172.16.32.1
2025-02-18 14:13:27,259 - 阻止來自未授權源 IP 172.16.38.93 的流量
2025-02-18 14:13:27,259 - 丟棄資料包: Ether / IP / TCP 172.16.38.93:49905 > 104.16.55.40:https A / Raw
2025-02-18 14:13:27,275 - 丟棄資料包: Ether / ARP who has 172.16.39.13 says 172.16.32.1
2025-02-18 14:13:27,275 - 阻止來自未授權源 IP 52.182.143.215 的流量
2025-02-18 14:13:27,275 - 丟棄資料包: Ether / IP / TCP 52.182.143.215:https > 172.16.38.93:50120 A
2025-02-18 14:13:27,275 - 阻止來自未授權源 IP 104.16.55.40 的流量
2025-02-18 14:13:27,275 - 丟棄資料包: Ether / IP / TCP 104.16.55.40:https > 172.16.38.93:49905 A
2025-02-18 14:13:27,577 - 丟棄資料包: Ether / ARP who has 172.16.33.80 says 172.16.32.1
2025-02-18 14:13:27,684 - 丟棄資料包: Ether / ARP who has 172.16.37.208 says 172.16.32.1
2025-02-18 14:13:28,292 - 丟棄資料包: Ether / ARP who has 172.16.38.147 says 172.16.32.1
2025-02-18 14:13:28,292 - 丟棄資料包: Ether / ARP who has 172.16.39.91 says 172.16.32.1
2025-02-18 14:13:28,707 - 丟棄資料包: Ether / ARP who has 172.16.37.208 says 172.16.32.1
2025-02-18 14:13:29,218 - 丟棄資料包: Ether / ARP who has 172.16.38.147 says 172.16.32.1
2025-02-18 14:13:29,729 - 丟棄資料包: Ether / ARP who has 172.16.38.6 says 172.16.32.1
2025-02-18 14:13:29,729 - 丟棄資料包: Ether / ARP who has 172.16.37.208 says 172.16.32.1
2025-02-18 14:13:29,806 - 阻止來自未授權源 IP 172.16.38.93 的流量
2025-02-18 14:13:29,808 - 丟棄資料包: Ether / IP / TCP 172.16.38.93:49902 > 104.18.157.37:https A / Raw
2025-02-18 14:13:29,840 - 阻止來自未授權源 IP 104.18.157.37 的流量
2025-02-18 14:13:29,840 - 丟棄資料包: Ether / IP / TCP 104.18.157.37:https > 172.16.38.93:49902 A
2025-02-18 14:13:30,243 - 丟棄資料包: Ether / ARP who has 172.16.38.147 says 172.16.32.1
2025-02-18 14:13:30,243 - 丟棄資料包: Ether / ARP who has 172.16.39.91 says 172.16.32.1
2025-02-18 14:13:30,482 - 阻止來自未授權源 IP 172.16.38.93 的流量
2025-02-18 14:13:30,482 - 丟棄資料包: Ether / IP / TCP 172.16.38.93:50033 > 203.69.81.41:https A / Raw
2025-02-18 14:13:30,489 - 阻止來自未授權源 IP 203.69.81.41 的流量
2025-02-18 14:13:30,489 - 丟棄資料包: Ether / IP / TCP 203.69.81.41:https > 172.16.38.93:50033 A
2025-02-18 14:13:30,523 - 阻止來自未授權源 IP 172.16.38.93 的流量
2025-02-18 14:13:30,523 - 丟棄資料包: Ether / IP / TCP 172.16.38.93:50048 > 172.64.155.209:https A / Raw
2025-02-18 14:13:30,540 - 阻止來自未授權源 IP 172.64.155.209 的流量
2025-02-18 14:13:30,540 - 丟棄資料包: Ether / IP / TCP 172.64.155.209:https > 172.16.38.93:50048 A
2025-02-18 14:13:30,658 - 丟棄資料包: Ether / ARP who has 172.16.38.6 says 172.16.32.1
2025-02-18 14:13:30,780 - 阻止來自未授權源 IP 172.16.38.93 的流量
2025-02-18 14:13:30,780 - 丟棄資料包: Ether / IP / TCP 172.16.38.93:50032 > 23.41.142.46:https A / Raw
2025-02-18 14:13:30,789 - 阻止來自未授權源 IP 23.41.142.46 的流量
2025-02-18 14:13:30,789 - 丟棄資料包: Ether / IP / TCP 23.41.142.46:https > 172.16.38.93:50032 A
2025-02-18 14:13:30,959 - 丟棄資料包: Ether / ARP who has 172.16.33.80 says 172.16.32.1
2025-02-18 14:13:31,261 - 丟棄資料包: Ether / ARP who has 172.16.38.147 says 172.16.32.1
2025-02-18 14:13:31,399 - 阻止來自未授權源 IP 172.16.38.93 的流量
2025-02-18 14:13:31,399 - 丟棄資料包: Ether / IP / TCP 172.16.38.93:50125 > 13.107.21.239:https A / Raw
2025-02-18 14:13:31,406 - 阻止來自未授權源 IP 13.107.21.239 的流量
2025-02-18 14:13:31,406 - 丟棄資料包: Ether / IP / TCP 13.107.21.239:https > 172.16.38.93:50125 A
2025-02-18 14:13:31,578 - 丟棄資料包: Ether / ARP who has 172.16.35.204 says 172.16.32.1
2025-02-18 14:13:31,987 - 丟棄資料包: Ether / ARP who has 172.16.33.80 says 172.16.32.1
2025-02-18 14:13:32,086 - 丟棄資料包: Ether / ARP who has 172.16.39.78 says 172.16.32.1
2025-02-18 14:13:32,288 - 丟棄資料包: Ether / ARP who has 172.16.38.147 says 172.16.32.1
2025-02-18 14:13:32,598 - 丟棄資料包: Ether / ARP who has 172.16.35.204 says 172.16.32.1
2025-02-18 14:13:32,906 - 丟棄資料包: Ether / ARP who has 172.16.33.80 says 172.16.32.1
2025-02-18 14:13:33,112 - 丟棄資料包: Ether / ARP who has 172.16.39.78 says 172.16.32.1
2025-02-18 14:13:33,623 - 丟棄資料包: Ether / ARP who has 172.16.35.204 says 172.16.32.1
2025-02-18 14:13:34,034 - 丟棄資料包: Ether / ARP who has 172.16.38.157 says 172.16.32.1
2025-02-18 14:13:34,132 - 丟棄資料包: Ether / ARP who has 172.16.39.78 says 172.16.32.1
2025-02-18 14:13:34,207 - 阻止來自未授權源 IP 172.16.38.93 的流量
2025-02-18 14:13:34,207 - 丟棄資料包: Ether / IP / UDP / DNS Qry b'safebrowsing.googleapis.com.'
2025-02-18 14:13:34,207 - 阻止來自未授權源 IP 172.16.38.93 的流量
2025-02-18 14:13:34,207 - 丟棄資料包: Ether / IP / UDP / DNS Qry b'safebrowsing.googleapis.com.'
2025-02-18 14:13:34,211 - 阻止來自未授權源 IP 3.233.158.24 的流量
2025-02-18 14:13:34,211 - 丟棄資料包: Ether / IP / TCP 3.233.158.24:https > 172.16.38.93:50124 PA / Raw
2025-02-18 14:13:34,211 - 阻止來自未授權源 IP 3.233.158.24 的流量
2025-02-18 14:13:34,211 - 丟棄資料包: Ether / IP / TCP 3.233.158.24:https > 172.16.38.93:50124 FA
2025-02-18 14:13:34,213 - 阻止來自未授權源 IP 172.16.38.93 的流量
2025-02-18 14:13:34,213 - 丟棄資料包: Ether / IP / TCP 172.16.38.93:50124 > 3.233.158.24:https A
2025-02-18 14:13:34,213 - 阻止來自未授權源 IP 3.233.158.24 的流量
2025-02-18 14:13:34,213 - 丟棄資料包: Ether / IP / TCP 3.233.158.24:https > 172.16.38.93:50123 PA / Raw
2025-02-18 14:13:34,213 - 阻止來自未授權源 IP 3.233.158.24 的流量
2025-02-18 14:13:34,215 - 丟棄資料包: Ether / IP / TCP 3.233.158.24:https > 172.16.38.93:50123 PA / Raw
2025-02-18 14:13:34,215 - 阻止來自未授權源 IP 3.233.158.24 的流量
2025-02-18 14:13:34,215 - 丟棄資料包: Ether / IP / TCP 3.233.158.24:https > 172.16.38.93:50124 FA
2025-02-18 14:13:34,217 - 阻止來自未授權源 IP 172.16.38.93 的流量
2025-02-18 14:13:34,217 - 丟棄資料包: Ether / IP / TCP 172.16.38.93:50123 > 3.233.158.24:https A
2025-02-18 14:13:34,217 - 阻止來自未授權源 IP 172.16.38.93 的流量
2025-02-18 14:13:34,217 - 丟棄資料包: Ether / IP / TCP 172.16.38.93:50124 > 3.233.158.24:https A
2025-02-18 14:13:34,217 - 阻止來自未授權源 IP 172.16.38.93 的流量
2025-02-18 14:13:34,217 - 丟棄資料包: Ether / IP / TCP 172.16.38.93:50123 > 3.233.158.24:https FA
2025-02-18 14:13:34,217 - 阻止來自未授權源 IP 3.233.158.24 的流量
2025-02-18 14:13:34,219 - 丟棄資料包: Ether / IP / TCP 3.233.158.24:https > 172.16.38.93:50123 PA / Raw
2025-02-18 14:13:34,219 - 阻止來自未授權源 IP 172.16.38.93 的流量
2025-02-18 14:13:34,219 - 丟棄資料包: Ether / IP / TCP 172.16.38.93:50123 > 3.233.158.24:https A
2025-02-18 14:13:34,221 - 阻止來自未授權源 IP 168.95.1.1 的流量
2025-02-18 14:13:34,221 - 丟棄資料包: Ether / IP / UDP / DNS Ans 142.250.204.42
2025-02-18 14:13:34,221 - 阻止來自未授權源 IP 168.95.1.1 的流量
2025-02-18 14:13:34,221 - 丟棄資料包: Ether / IP / UDP / DNS Ans
2025-02-18 14:13:34,223 - 阻止來自未授權源 IP 172.16.38.93 的流量
2025-02-18 14:13:34,223 - 丟棄資料包: Ether / IP / TCP 172.16.38.93:50136 > 142.250.204.42:https S
2025-02-18 14:13:34,230 - 阻止來自未授權源 IP 142.250.204.42 的流量
2025-02-18 14:13:34,230 - 丟棄資料包: Ether / IP / TCP 142.250.204.42:https > 172.16.38.93:50136 SA
2025-02-18 14:13:34,230 - 阻止來自未授權源 IP 172.16.38.93 的流量
2025-02-18 14:13:34,230 - 丟棄資料包: Ether / IP / TCP 172.16.38.93:50136 > 142.250.204.42:https A
2025-02-18 14:13:34,230 - 阻止來自未授權源 IP 172.16.38.93 的流量
2025-02-18 14:13:34,230 - 丟棄資料包: Ether / IP / TCP 172.16.38.93:50136 > 142.250.204.42:https PA / Raw
2025-02-18 14:13:34,263 - 阻止來自未授權源 IP 172.16.38.93 的流量
2025-02-18 14:13:34,263 - 丟棄資料包: Ether / IP / TCP 172.16.38.93:50136 > 142.250.204.42:https PA / Raw
2025-02-18 14:13:34,306 - 阻止來自未授權源 IP 142.250.204.42 的流量
2025-02-18 14:13:34,306 - 丟棄資料包: Ether / IP / TCP 142.250.204.42:https > 172.16.38.93:50136 PA / Raw
2025-02-18 14:13:34,306 - 阻止來自未授權源 IP 172.16.38.93 的流量
2025-02-18 14:13:34,306 - 丟棄資料包: Ether / IP / TCP 172.16.38.93:50136 > 142.250.204.42:https A
2025-02-18 14:13:34,312 - 阻止來自未授權源 IP 142.250.204.42 的流量
2025-02-18 14:13:34,312 - 丟棄資料包: Ether / IP / TCP 142.250.204.42:https > 172.16.38.93:50136 A
2025-02-18 14:13:34,314 - 阻止來自未授權源 IP 142.250.204.42 的流量
2025-02-18 14:13:34,314 - 丟棄資料包: Ether / IP / TCP 142.250.204.42:https > 172.16.38.93:50136 PA / Raw
2025-02-18 14:13:34,314 - 阻止來自未授權源 IP 172.16.38.93 的流量
2025-02-18 14:13:34,314 - 丟棄資料包: Ether / IP / TCP 172.16.38.93:50136 > 142.250.204.42:https A
2025-02-18 14:13:34,339 - 阻止來自未授權源 IP 142.250.204.42 的流量
2025-02-18 14:13:34,339 - 丟棄資料包: Ether / IP / TCP 142.250.204.42:https > 172.16.38.93:50136 PA / Raw
2025-02-18 14:13:34,339 - 阻止來自未授權源 IP 172.16.38.93 的流量
2025-02-18 14:13:34,339 - 丟棄資料包: Ether / IP / TCP 172.16.38.93:50136 > 142.250.204.42:https A
2025-02-18 14:13:34,339 - 阻止來自未授權源 IP 172.16.38.93 的流量
2025-02-18 14:13:34,339 - 丟棄資料包: Ether / IP / TCP 172.16.38.93:50136 > 142.250.204.42:https PA / Raw
2025-02-18 14:13:34,339 - 阻止來自未授權源 IP 172.16.38.93 的流量
2025-02-18 14:13:34,344 - 丟棄資料包: Ether / IP / TCP 172.16.38.93:50136 > 142.250.204.42:https PA / Raw
2025-02-18 14:13:34,345 - 阻止來自未授權源 IP 172.16.38.93 的流量
2025-02-18 14:13:34,345 - 丟棄資料包: Ether / IP / TCP 172.16.38.93:50136 > 142.250.204.42:https PA / Raw
2025-02-18 14:13:34,355 - 阻止來自未授權源 IP 142.250.204.42 的流量
2025-02-18 14:13:34,355 - 丟棄資料包: Ether / IP / TCP 142.250.204.42:https > 172.16.38.93:50136 PA / Raw
2025-02-18 14:13:34,355 - 阻止來自未授權源 IP 172.16.38.93 的流量
2025-02-18 14:13:34,355 - 丟棄資料包: Ether / IP / TCP 172.16.38.93:50136 > 142.250.204.42:https PA / Raw
2025-02-18 14:13:34,358 - 阻止來自未授權源 IP 142.250.204.42 的流量
2025-02-18 14:13:34,358 - 丟棄資料包: Ether / IP / TCP 142.250.204.42:https > 172.16.38.93:50136 PA / Raw
2025-02-18 14:13:34,360 - 阻止來自未授權源 IP 142.250.204.42 的流量
2025-02-18 14:13:34,360 - 丟棄資料包: Ether / IP / TCP 142.250.204.42:https > 172.16.38.93:50136 PA / Raw
2025-02-18 14:13:34,360 - 阻止來自未授權源 IP 142.250.204.42 的流量
2025-02-18 14:13:34,361 - 丟棄資料包: Ether / IP / TCP 142.250.204.42:https > 172.16.38.93:50136 PA / Raw
2025-02-18 14:13:34,361 - 阻止來自未授權源 IP 142.250.204.42 的流量
2025-02-18 14:13:34,361 - 丟棄資料包: Ether / IP / TCP 142.250.204.42:https > 172.16.38.93:50136 PA / Raw
2025-02-18 14:13:34,361 - 阻止來自未授權源 IP 172.16.38.93 的流量
2025-02-18 14:13:34,361 - 丟棄資料包: Ether / IP / TCP 172.16.38.93:50136 > 142.250.204.42:https A
2025-02-18 14:13:34,361 - 阻止來自未授權源 IP 172.16.38.93 的流量
2025-02-18 14:13:34,361 - 丟棄資料包: Ether / IP / TCP 172.16.38.93:50136 > 142.250.204.42:https PA / Raw
2025-02-18 14:13:34,364 - 阻止來自未授權源 IP 142.250.204.42 的流量
2025-02-18 14:13:34,364 - 丟棄資料包: Ether / IP / TCP 142.250.204.42:https > 172.16.38.93:50136 A
2025-02-18 14:13:34,417 - 阻止來自未授權源 IP 3.233.158.24 的流量
2025-02-18 14:13:34,417 - 丟棄資料包: Ether / IP / TCP 3.233.158.24:https > 172.16.38.93:50123 PA / Raw
2025-02-18 14:13:34,417 - 阻止來自未授權源 IP 172.16.38.93 的流量
2025-02-18 14:13:34,419 - 丟棄資料包: Ether / IP / TCP 172.16.38.93:50123 > 3.233.158.24:https RA
2025-02-18 14:13:34,419 - 阻止來自未授權源 IP 3.233.158.24 的流量
2025-02-18 14:13:34,419 - 丟棄資料包: Ether / IP / TCP 3.233.158.24:https > 172.16.38.93:50123 FA
2025-02-18 14:13:34,526 - 阻止來自未授權源 IP 172.16.38.93 的流量
2025-02-18 14:13:34,526 - 丟棄資料包: Ether / IP / TCP 172.16.38.93:50031 > 23.39.61.133:https A / Raw
2025-02-18 14:13:34,534 - 丟棄資料包: Ether / ARP who has 172.16.38.147 says 172.16.32.1
2025-02-18 14:13:34,543 - 阻止來自未授權源 IP 23.39.61.133 的流量
2025-02-18 14:13:34,543 - 丟棄資料包: Ether / IP / TCP 23.39.61.133:https > 172.16.38.93:50031 A
2025-02-18 14:13:34,823 - 阻止來自未授權源 IP 172.16.38.93 的流量
2025-02-18 14:13:34,824 - 丟棄資料包: Ether / IP / TCP 172.16.38.93:50030 > 23.39.61.133:https A / Raw
2025-02-18 14:13:34,870 - 阻止來自未授權源 IP 23.39.61.133 的流量
2025-02-18 14:13:34,870 - 丟棄資料包: Ether / IP / TCP 23.39.61.133:https > 172.16.38.93:50030 A
2025-02-18 14:13:35,051 - 丟棄資料包: Ether / ARP who has 172.16.39.13 says 172.16.32.1
2025-02-18 14:13:35,051 - 丟棄資料包: Ether / ARP who has 172.16.33.80 says 172.16.32.1
2025-02-18 14:13:35,051 - 丟棄資料包: Ether / ARP who has 172.16.38.157 says 172.16.32.1
2025-02-18 14:13:35,271 - 丟棄資料包: Ether / ARP who has 172.16.38.6 says 172.16.32.1
2025-02-18 14:13:35,468 - 丟棄資料包: Ether / ARP who has 172.16.39.78 says 172.16.32.1
2025-02-18 14:13:35,541 - 阻止來自未授權源 IP 172.16.38.93 的流量
2025-02-18 14:13:35,541 - 丟棄資料包: Ether / IP / TCP 172.16.38.93:50046 > 146.75.47.52:https A / Raw
2025-02-18 14:13:35,569 - 丟棄資料包: Ether / ARP who has 172.16.38.147 says 172.16.32.1
2025-02-18 14:13:35,611 - 阻止來自未授權源 IP 146.75.47.52 的流量
2025-02-18 14:13:35,611 - 丟棄資料包: Ether / IP / TCP 146.75.47.52:https > 172.16.38.93:50046 A
2025-02-18 14:13:35,941 - 阻止來自未授權源 IP 172.16.38.93 的流量
2025-02-18 14:13:35,941 - 丟棄資料包: Ether / IP / TCP 172.16.38.93:49791 > 23.39.61.97:https FA
2025-02-18 14:13:35,943 - 阻止來自未授權源 IP 172.16.38.93 的流量
2025-02-18 14:13:35,943 - 丟棄資料包: Ether / IP / TCP 172.16.38.93:50108 > 52.231.186.36:https FA
2025-02-18 14:13:35,980 - 丟棄資料包: Ether / ARP who has 172.16.39.13 says 172.16.32.1
2025-02-18 14:13:35,990 - 阻止來自未授權源 IP 23.39.61.97 的流量
2025-02-18 14:13:35,990 - 丟棄資料包: Ether / IP / TCP 23.39.61.97:https > 172.16.38.93:49791 PA / Raw
2025-02-18 14:13:35,990 - 阻止來自未授權源 IP 23.39.61.97 的流量
2025-02-18 14:13:35,990 - 丟棄資料包: Ether / IP / TCP 23.39.61.97:https > 172.16.38.93:49791 FA
2025-02-18 14:13:35,996 - 阻止來自未授權源 IP 172.16.38.93 的流量
2025-02-18 14:13:35,996 - 丟棄資料包: Ether / IP / TCP 172.16.38.93:49791 > 23.39.61.97:https RA
2025-02-18 14:13:36,011 - 阻止來自未授權源 IP 52.231.186.36 的流量
2025-02-18 14:13:36,011 - 丟棄資料包: Ether / IP / TCP 52.231.186.36:https > 172.16.38.93:50108 FA
2025-02-18 14:13:36,011 - 阻止來自未授權源 IP 172.16.38.93 的流量
2025-02-18 14:13:36,011 - 丟棄資料包: Ether / IP / TCP 172.16.38.93:50108 > 52.231.186.36:https A
2025-02-18 14:13:36,071 - 丟棄資料包: Ether / ARP who has 172.16.33.80 says 172.16.32.1
2025-02-18 14:13:36,071 - 丟棄資料包: Ether / ARP who has 172.16.38.157 says 172.16.32.1
2025-02-18 14:13:36,078 - 丟棄資料包: Ether / ARP who has 172.16.35.204 says 172.16.32.1
2025-02-18 14:13:36,123 - 阻止來自未授權源 IP 172.16.38.93 的流量
2025-02-18 14:13:36,123 - 丟棄資料包: Ether / IP / TCP 172.16.38.93:50044 > 146.75.47.52:https A / Raw
2025-02-18 14:13:36,180 - 阻止來自未授權源 IP 146.75.47.52 的流量
2025-02-18 14:13:36,180 - 丟棄資料包: Ether / IP / TCP 146.75.47.52:https > 172.16.38.93:50044 A
2025-02-18 14:13:36,281 - 丟棄資料包: Ether / ARP who has 172.16.38.6 says 172.16.32.1
2025-02-18 14:13:36,389 - 丟棄資料包: Ether / ARP who has 172.16.39.78 says 172.16.32.1
2025-02-18 14:13:36,593 - 丟棄資料包: Ether / ARP who has 172.16.38.147 says 172.16.32.1
2025-02-18 14:13:36,685 - 丟棄資料包: Ether / ARP who has 172.16.39.26 says 172.16.32.1
2025-02-18 14:13:37,001 - 丟棄資料包: Ether / ARP who has 172.16.39.13 says 172.16.32.1
2025-02-18 14:13:37,001 - 丟棄資料包: Ether / ARP who has 172.16.33.80 says 172.16.32.1
2025-02-18 14:13:37,104 - 丟棄資料包: Ether / ARP who has 172.16.35.204 says 172.16.32.1
2025-02-18 14:13:37,305 - 丟棄資料包: Ether / ARP who has 172.16.38.6 says 172.16.32.1
2025-02-18 14:13:37,411 - 丟棄資料包: Ether / ARP who has 172.16.39.78 says 172.16.32.1
2025-02-18 14:13:37,712 - 丟棄資料包: Ether / ARP who has 172.16.39.26 says 172.16.32.1
2025-02-18 14:13:38,127 - 丟棄資料包: Ether / ARP who has 172.16.35.204 says 172.16.32.1
2025-02-18 14:13:38,741 - 丟棄資料包: Ether / ARP who has 172.16.39.26 says 172.16.32.1
2025-02-18 14:13:38,745 - 丟棄資料包: Ether / ARP who has 172.16.39.78 says 172.16.32.1
2025-02-18 14:13:38,768 - 阻止來自未授權源 IP 172.16.38.93 的流量
2025-02-18 14:13:38,768 - 丟棄資料包: Ether / IP / TCP 172.16.38.93:50045 > 146.75.47.52:https A / Raw
2025-02-18 14:13:38,772 - 阻止來自未授權源 IP 35.162.31.18 的流量
2025-02-18 14:13:38,772 - 丟棄資料包: Ether / IP / TCP 35.162.31.18:https > 172.16.38.93:56966 FPA / Raw
2025-02-18 14:13:38,832 - 阻止來自未授權源 IP 146.75.47.52 的流量
2025-02-18 14:13:38,832 - 丟棄資料包: Ether / IP / TCP 146.75.47.52:https > 172.16.38.93:50045 A
2025-02-18 14:13:38,942 - 丟棄資料包: Ether / ARP who has 172.16.38.147 says 172.16.32.1
2025-02-18 14:13:39,660 - 丟棄資料包: Ether / ARP who has 172.16.33.224 says 172.16.32.1
2025-02-18 14:13:39,768 - 丟棄資料包: Ether / ARP who has 172.16.39.78 says 172.16.32.1
2025-02-18 14:13:40,070 - 丟棄資料包: Ether / ARP who has 172.16.38.147 says 172.16.32.1
2025-02-18 14:13:40,534 - 阻止來自未授權源 IP 172.16.38.93 的流量
2025-02-18 14:13:40,534 - 丟棄資料包: Ether / IP / UDP / DNS Qry b'p2p-hkg1.discovery.steamserver.net.'
2025-02-18 14:13:40,547 - 阻止來自未授權源 IP 168.95.1.1 的流量
2025-02-18 14:13:40,547 - 丟棄資料包: Ether / IP / UDP / DNS Ans 103.28.54.187
2025-02-18 14:13:40,585 - 阻止來自未授權源 IP 172.16.38.93 的流量
2025-02-18 14:13:40,585 - 丟棄資料包: Ether / IP / TCP 172.16.38.93:50064 > 146.75.47.52:https A / Raw
2025-02-18 14:13:40,590 - 丟棄資料包: Ether / ARP who has 172.16.33.224 says 172.16.32.1
2025-02-18 14:13:40,886 - 丟棄資料包: Ether / ARP who has 172.16.38.147 says 172.16.32.1
2025-02-18 14:13:41,102 - 丟棄資料包: Ether / ARP who has 172.16.39.26 says 172.16.32.1
2025-02-18 14:13:41,303 - 丟棄資料包: Ether / ARP who has 172.16.35.204 says 172.16.32.1
2025-02-18 14:13:41,611 - 丟棄資料包: Ether / ARP who has 172.16.33.224 says 172.16.32.1
2025-02-18 14:13:41,822 - 阻止來自未授權源 IP 172.16.38.93 的流量
2025-02-18 14:13:41,822 - 丟棄資料包: Ether / IP / TCP 172.16.38.93:50062 > 146.75.47.52:https A / Raw
2025-02-18 14:13:41,822 - 阻止來自未授權源 IP 146.75.47.52 的流量
2025-02-18 14:13:41,822 - 丟棄資料包: Ether / IP / TCP 146.75.47.52:https > 172.16.38.93:50064 A
2025-02-18 14:13:41,889 - 阻止來自未授權源 IP 146.75.47.52 的流量
2025-02-18 14:13:41,889 - 丟棄資料包: Ether / IP / TCP 146.75.47.52:https > 172.16.38.93:50062 A
2025-02-18 14:13:42,327 - 丟棄資料包: Ether / ARP who has 172.16.35.204 says 172.16.32.1
2025-02-18 14:13:42,529 - 阻止來自未授權源 IP 172.16.38.93 的流量
2025-02-18 14:13:42,529 - 丟棄資料包: Ether / IP / TCP 172.16.38.93:49957 > 103.28.54.101:27021 PA / Raw
2025-02-18 14:13:42,554 - 阻止來自未授權源 IP 54.92.92.124 的流量
2025-02-18 14:13:42,554 - 丟棄資料包: Ether / IP / TCP 54.92.92.124:https > 172.16.38.93:56964 FPA / Raw
2025-02-18 14:13:42,571 - 阻止來自未授權源 IP 103.28.54.101 的流量
2025-02-18 14:13:42,571 - 丟棄資料包: Ether / IP / TCP 103.28.54.101:27021 > 172.16.38.93:49957 A
2025-02-18 14:13:42,629 - 丟棄資料包: Ether / ARP who has 172.16.37.236 says 172.16.32.1
2025-02-18 14:13:42,629 - 丟棄資料包: Ether / ARP who has 172.16.39.91 says 172.16.32.1
